enabled;type;vendor;details
TRUE;ABC;Cimprogetti;Compact design, counter-current flow, versatile fuel options, medium-high to low-reactivity lime
TRUE;Flex_ReVerSy;Cimprogetti;Direct crossover channel, high- and medium-reactivity lime, energy-efficient
TRUE;Vanguard;Cimprogetti;Radial crossover channel, large capacity, superior lime quality
TRUE;TwinD;Cimprogetti;Direct crossover channel, high-quality lime, reduced environmental impact
TRUE;TurNOx;Cimprogetti;SCR system, reduces NOx emissions, integrates with regenerative kilns
